{
  "$schema": "urn:openaix:schema:orbit:0.2.0-draft.1",
  "active": {
    "end": "2026-10-02T15:00:00Z",
    "start": "2026-10-02T13:00:00Z"
  },
  "altitude": {
    "lower": {
      "reference": "FL",
      "unit": "flight_level",
      "value": 240
    },
    "upper": {
      "reference": "FL",
      "unit": "flight_level",
      "value": 260
    }
  },
  "description": "Racetrack north-west of the objective area, used first for combat air patrol and then for airborne early warning.",
  "geometry": {
    "kind": "racetrack",
    "leg_length": {
      "unit": "nm",
      "value": 20
    },
    "point": {
      "latitude": 35.235,
      "longitude": 39.625
    },
    "radial": {
      "reference": "true",
      "value": 90
    },
    "turns": "right"
  },
  "id": "tiger-orbit",
  "name": "Tiger",
  "type": "ORBIT"
}
